{
  "id": "IMPORT-APLUS-1202-LESSON-16-SAMPLE",
  "certificationId": "a-plus-220-1202",
  "lessonId": "lesson-16-sample",
  "sourceTranscript": "data/transcripts/cleaned/a-plus-220-1202/16-sample.txt",
  "status": "pending-review",
  "createdAt": "2026-06-23T00:00:00.000Z",
  "notes": [
    "Sample file for testing the review UI. Replace with real transcript candidates."
  ],
  "candidates": [
    {
      "candidateId": "CAND-001",
      "title": "Windows Firewall",
      "slug": "windows-firewall",
      "proposedKnowledgeId": "APLUS-1202-SEC-WINDOWS-FIREWALL",
      "category": "security",
      "aliases": ["Microsoft Defender Firewall"],
      "confidence": 0.92,
      "summaryDraft": "Windows Firewall controls inbound and outbound network traffic based on configured rules and profiles.",
      "factsDraft": [
        "Firewall profiles commonly include domain, private, and public networks.",
        "Rules can allow or block traffic based on app, port, protocol, or direction."
      ],
      "examTipsDraft": [
        "Know when to check firewall rules during application connectivity troubleshooting."
      ],
      "evidence": [
        { "line": 12, "text": "Windows Firewall allows you to configure rules for different network profiles." },
        { "line": 24, "text": "Inbound and outbound rules can permit or block application traffic." }
      ],
      "possibleDuplicates": [],
      "suggestedRelationships": [
        { "target": "APLUS-1202-NET-PORTS", "type": "uses", "reason": "Firewall rules often reference ports." }
      ],
      "reviewDecision": "undecided",
      "reviewNotes": ""
    },
    {
      "candidateId": "CAND-002",
      "title": "Command Prompt",
      "slug": "command-prompt",
      "proposedKnowledgeId": "APLUS-1202-CMD-COMMAND-PROMPT",
      "category": "commands",
      "aliases": ["cmd", "cmd.exe"],
      "confidence": 0.77,
      "summaryDraft": "Command Prompt is a Windows command-line interface used to run administrative, file, and network commands.",
      "factsDraft": [
        "Command Prompt can run tools like ipconfig, ping, and netstat.",
        "Some commands require elevated administrator permissions."
      ],
      "examTipsDraft": [
        "Differentiate Command Prompt from PowerShell on scenario questions."
      ],
      "evidence": [
        { "line": 44, "text": "From the command prompt, we can run utilities such as ipconfig." }
      ],
      "possibleDuplicates": [
        { "knowledgeId": "APLUS-1202-CMD-IPCONFIG", "title": "ipconfig", "reason": "Transcript evidence references ipconfig, but this candidate is broader.", "score": 0.41 }
      ],
      "suggestedRelationships": [
        { "target": "APLUS-1202-CMD-IPCONFIG", "type": "runs", "reason": "Command Prompt can execute ipconfig." }
      ],
      "reviewDecision": "undecided",
      "reviewNotes": ""
    }
  ]
}
